{
  "$id": "frp.m28.hierarchy_qualification.v3.0.0",
  "$schema": "https://json-schema.org/draft/2020-12/schema",
  "additionalProperties": false,
  "properties": {
    "artifacts": {},
    "check_count": {},
    "checks": {},
    "failed_count": {},
    "kind": {
      "const": "hierarchy_qualification"
    },
    "milestone": {
      "const": "M28"
    },
    "passed_count": {},
    "qualification_digest": {},
    "qualification_id": {},
    "schema": {
      "const": "frp.m28.hierarchy_qualification.v3.0.0"
    },
    "schemas": {},
    "source_commit": {
      "const": "23e464206f85cd9473101d9221027ee33d9dd094"
    },
    "status": {
      "const": "PASS"
    },
    "version": {
      "const": "3.0.0"
    }
  },
  "required": [
    "schema",
    "kind",
    "version",
    "milestone",
    "status",
    "source_commit",
    "qualification_id",
    "check_count",
    "passed_count",
    "failed_count",
    "checks",
    "artifacts",
    "schemas",
    "qualification_digest"
  ],
  "title": "hierarchy_qualification",
  "type": "object"
}
